{
	"format": "crypto-ledger",
	"version": 1,
	"createdAt": "2025-06-30T12:00:00Z",
	"generator": "example",
	"currency": "EUR",
	"accounts": [{ "id": "kraken", "type": "exchange", "name": "Kraken", "exchange": "kraken" }],
	"movements": [
		{
			"id": "LEXAMP-AAAAA-AAAAAA",
			"account": "kraken",
			"time": "2025-01-05T10:00:00Z",
			"date": "2025-01-05",
			"kind": "trade",
			"asset": { "symbol": "EUR", "decimals": 2 },
			"amount": "-500.00",
			"value": {
				"amount": "-500.00",
				"rate": "1",
				"source": "currency",
				"at": "2025-01-05T10:00:00Z"
			},
			"ref": "TEXAMP-BBBBB-BBBBBB",
			"sourceType": "trade"
		},
		{
			"id": "LEXAMP-CCCCC-CCCCCC",
			"account": "kraken",
			"time": "2025-01-05T10:00:00Z",
			"date": "2025-01-05",
			"kind": "trade",
			"asset": { "symbol": "BTC", "decimals": 10 },
			"amount": "0.00625",
			"value": {
				"amount": "500.00",
				"rate": "80000",
				"source": "trade",
				"at": "2025-01-05T10:00:00Z"
			},
			"ref": "TEXAMP-BBBBB-BBBBBB",
			"sourceType": "trade"
		},
		{
			"id": "LEXAMP-CCCCC-CCCCCC:fee",
			"account": "kraken",
			"time": "2025-01-05T10:00:00Z",
			"date": "2025-01-05",
			"kind": "fee",
			"asset": { "symbol": "BTC", "decimals": 10 },
			"amount": "-0.00001",
			"value": {
				"amount": "-0.80",
				"rate": "80000",
				"source": "trade",
				"at": "2025-01-05T10:00:00Z"
			},
			"ref": "TEXAMP-BBBBB-BBBBBB",
			"sourceType": "trade"
		},
		{
			"id": "LEXAMP-DDDDD-DDDDDD",
			"account": "kraken",
			"time": "2025-01-20T09:00:00Z",
			"date": "2025-01-20",
			"kind": "transfer",
			"asset": { "symbol": "BTC", "decimals": 10 },
			"amount": "-0.006",
			"value": {
				"amount": "-480.00",
				"rate": "80000",
				"source": "coingecko",
				"at": "2025-01-20T00:00:00Z"
			},
			"ref": "FEXAMP-EEEEE-EEEEEE",
			"txHash": "dddddddddddddddddddddddddddddddddddddddddddddddddddddddddddddddd",
			"network": "Bitcoin",
			"sourceType": "withdrawal"
		}
	]
}
